id,text
2253,لقاح صينى لكورونا يظهر نتائج واعدة فى اختبار على صحة الحيوانات
2254,باركنسون ليس مرضا واحدا .. اعرف آراء العلماء
2255,باحثون يتوصلون لأسباب وراثية ومناعية تفسر إصابة البعض بحالة كورونا شديدة
2256,التلامس الجلدى مع الوالدين يساعد الأطفال حديثى الولادة فى التغلب على الألم
2257,لماذا نحتاج إلى أكثر من جرعة عند تناول بعض اللقاحات؟
2258,الجسيمات المحملة بكورونا تدور حول المصعد نصف ساعة بعد سعال شخص مصاب
2259,مضاعفات كورونا لا تنتهى.. دراسة تؤكد ظهور علامات تلف بالقلب بعد التعافى
2260,الأقليات العرقية ليسوا أكثر عرضة من الناحية الجينية لخطر الوفاة من Covid-19
2261,اطمن على نفسك.. ما هى فحوصات العين؟
2262,سينوفاك الصينية تعلن جاهزية لقاح كورونا أول 2021
2263,6 طرق لمنع إصابة الأطفال بفيروس كورونا مع عودة المدارس.. إنفوجراف
2264,"5 عادات خاطئة تجنبها ""لو بتعمل دايت"" للحصول على نتائج أفضل.. إنفوجراف"
2265,اعرف ما يمكن أن تخبرك به أظافرك عن صحتك
2266,"طبيب نفسى يكشف عن أكثر دواء فعال لعلاج مرض العصر ""الاكتئاب """
2267,الجلوس لفترات طويلة يزيد من خطر موت الشباب.. دراسة توضح
2268,"السرعة والمتطوعون.. اللقاح الـ11 يستفيد من ""موجة كورونا"""
2269,إصابات كورونا بأمريكا تتخطى رقما جديدا وارتفاع بألمانيا
2270,نوفافاكس تبدأ ثالث مراحل التجارب السريرية على لقاح كورونا فى بريطانيا
2271,احذر.. ارتداء كمامة متسخة يصيبك بالتهاب الحلق
2272,س و ج.. كل ما تريد معرفته عن الكتف المتجمدة وأعراض الإصابة
2273,تحليل الدم الروتينى قد يتنبأ بزيادة مخاطر الوفاة لدى مرضى كورونا
2274,الأدوية المخفضة للكوليسترول تقلل من شدة فيروس كورونا لهذا السبب
2275,انخفاض نسبة الزنك فى الدم يزيد من فرص الوفاة بكورونا.. 5 أطعمة غنية به
2276,نقص الفيتامينات ليس السبب الوحيد فى التعب المزمن.. اعرف التفاصيل
2277,علماء يكتشفون مادة توقف النزيف الحاد بسرعة
2278,أسباب آلام اليد عديدة وأبرزها النقرس أو هشاشة العظام
2279,علاج حصوات الكلى بطرق عديدة منها المنظار والجراحة والأدوية
2280,تعرف على فوائد الجوز الصحية للسيطرة على مرض السكر
2281,CDC: النساء أكثر عرضة لتجربة القلق والاكتئاب
2282,
2283,مخاوف متزايدة من تسبب كورونا فى موجة إصابة بمرض باركنسون
2284,أستاذ أمراض صدرية: مريض كورونا يصبح متعافيا بعد اختفاء الأعراض بـ7 أيام
2285,3 كليات حكومية بالهند تشارك فى تجارب لقاح كوفاكسين وتعويض مالى للمتطوعين
2286,خمس البالغين فى بريطانيا يرفضون الحصول على لقاح كورونا عند صنعه
2287,السمنة تزيد خطر الإصابة بالتهاب المفاصل الروماتويدى
2288,اطمن على نفسك.. ما هو تحليل الألبومين فى البول ؟
2289,5 أطعمة احرص على إضافتها لنظامك الغذائى للحفاظ على قوة عظامك
2290,تعرف على موقف تجارب لقاحات كورونا من الأطفال وموعد إجرائها
2291,خبراء الصحة يطالبون FDA بتنظيم وضع المواد الكيميائية الضارة على الأطعمة
2292,طرح 700 مليون جرعة من لقاح فيروس كورونا لــ350 مليون أمريكى بحلول مارس
2293,اعرف محيط خصرك المثالى.. كل زيادة 10سم تزيد خطر الوفاة المبكرة بنسبة11%
2294,"الصحة العالمية تستعد للترويج للقاح الروسى لفيروس كورونا ""سبوتنيكV"""
2295,رئيس مركز السيطرة على الأمراض: تطعيم الأمريكيين بلقاح كورونا بحلول يوليو
2296,مراهقة برازيلية تثير حيرة الأطباء لبكائها دما بدلا من الدموع
2297,نمط الحياة الصحى يساعد على العيش فترة أطول حتى مع الأمراض المزمنة
2298,س و ج.. ما هى عوامل الخطر التى تزيد من فرص الإصابة بسرطان الثدى؟
2299,ليه لون أسنانك دايما أصفر.. اعرف السبب وعالجه
2300,أفضل 7 أطعمة تحتوى على كالسيوم أكثر من الحليب
2301,5 أخطاء تعرض قلبك للخطر.. تعرف عليها وطرق تجنبها
2302,5 أطعمة خالية من الجلوتين لمرضى الاضطرابات الهضمية
2303,أعراض نقص فيتامين د عديدة أبرزها الاكتئاب والإرهاق
2304,فوائد العسل الأسود على صحتك وجمالك
2305,تعرف على طرق علاج الانتفاخ بخطوات بسيطة فى المنزل
2306,"8 علامات حيوية يجب مراقبتها بعد الخروج من المستشفى""لو متعافى من كورونا"""
2307,6 خطوات للآباء والأمهات لحماية أطفالهم فى أوقات الإصابة بفيروس كورونا
2308,اعرف نسبة إصابتك بفيروس كورونا حسب لون بشرتك
2309,رئيس إدارة الشئون الوقائية بالصحة يكشف أهمية مصل الأنفلونزا الموسمية
2310,لماذا يتمتع الأطفال بحماية أكبر من كورونا؟
2311,"جراح بجامعة بنها يكشف كواليس استخراج ""موبايل"" من معدة مواطن: ""كان مراهن صحابه"""
2312,درع الوجه البلاستيكى لا يمنع انتشار فيروس كورونا.. دراسة تكشف التفاصيل
2313,معظم المصابين بفيروس كورونا تظهر عليهم الأعراض
2314,السر فى الروابط الجينية والعاطفية.. لماذا نصاب بالصداع النصفى
2315,اكتشاف مستوى عالٍ من تلوث فيروس كورونا فى مراحيض وهواء المستشفيات
2316,اطمن على نفسك.. تحليل الهابتوجلوبين لمعرفة نوع الأنيميا لديك
2317,الهند توقع اتفاقا مع كلية طب واشنطن للحصول على لقاح كورونا الأنفى
2318,شركة فالنيفا الفرنسية تتوقع الموافقة على لقاحها لفيروس كورونا منتصف 2021
2319,دراسة على 3.5 مليون طفل تثبت زيادة خطر التوحد عند الولادة قبل 40 أسبوعا
2320,اليابان تتوقع الموافقة على عقار أفيجان لعلاج فيروس كورونا أكتوبر المقبل
2321,تغيير لون البول لطفلة يهدد حياتها فى عمر الـ 18 بسبب مرض نادر
2322,
2323,الصين وروسيا والولايات المتحدة لم تنضم لمبادرة كوفاكس لدعم لقاحات كورونا
2324,الهند تبدأ التجارب الأخيرة للقاح فيروس كورونا الروسى فى الأسابيع المقبلة
2325,الهند تصدر توجيهات لمصنعى لقاحات كورونا أهمها تحقيق فاعلية بنسبة 50%
2326,FDA تضع معايير صارمة قبل الموافقة الطارئة لاستخدام لقاح فيروس كورونا
2327,CDC يحدد 16 أكتوبر موعدا نهائيا لتقديم الدول خططها لتوزيع لقاحات كورونا
2328,الإصابة بكورونا والإنفلونزا فى نفس الوقت تجعلك عرضة للوفاة 6 مرات أسرع
2329,هل يتحول مرض السكرى من النوع الثانى إلى النوع الأول؟
2330,س وج .. ما هو تمزق الرباط الصليبى الخلفى وما أعراضه؟
2331,أسباب محتملة تجعل مرضى السمنة أكثر عرضة لمضاعفات كورونا
2332,5 أطعمة غنية بأحماض أوميجا 3 الدهنية لصحة قلبك
2333,هل يمكن أن يتسبب التوتر فى تأخر الدورة الشهرية؟
2334,لماذا يطلب طبيبك فحوصات مرض السكر.. للرجال فقط
2335,نصائح هامة لا تنساها لتقويه جهازك المناعى
2336,أسباب الاسهال الشائعة أبرزها فيروس فى المعدة
2337,تعرف على فوائد الزيتون الصحية للسيطرة على مرض السكر
2338,5 نصائح صحية لفقدان الوزن والتخلص من دهون البطن
2339,إنقاص الوزن يساعد فى إصلاح تلف البنكرياس لدى مرضى السكر
2340,ما مراحل تصنيع اللقاح وكم عدد لقاحات كورونا فى التجارب البشرية؟
2341,استشارى وبائيات يوضح أهمية التجارب المعملية لخضوع أي لقاح للتجارب السريرية
2342,السر فى مرارة الأشياء.. اختبار تذوق يتنبأ بأنك أكثر عرضة لمضاعفات كورونا
2343,روسيا تتلقى طلبات للتزويد بــ1.2 مليار جرعة من لقاح Sputnik V لكورونا
2344,الناجون من هذا المرض لديهم مناعة ضد كورونا
2345,احمى نفسك وأحبابك من الإنفلونزا بهذه الخطوات.. إنفوجراف
2346,طول الوقت الذى تتعرض فيه لكورونا يزيد احتمال إصابتك بالعدوى
2347,اطمن على نفسك..ما هو فحص هرمون الغدة الجاردرقية وأهميته؟
2348,لقاح كورونا الصينى لم يسبب أى آثار جانبية على المتطوعين الروس فى التجارب
2349,الصحة العالمية تعلن مسئولية التبغ عن 20 % من وفيات أمراض القلب التاجية
2350,لقاح الأنفلونزا لا يزيد من خطر الإصابة بكورونا.. دراسة أمريكية تؤكد
2351,مرضى ارتفاع ضغط الدم أكثر عرضة للإصابة بفيروس كورونا
2352,"أمريكا تواجه أزمة ملايين الخنازير الوحشية ""يمكنها استضافة 30 مرضا فيروسيا"""
2353,انطلاق المرحلة الثالثة لتجارب لقاح أكسفورد في الهند بحقن 200 متطوع
2354,روسيا لن تحتاج لإغلاق جديد بسبب كورونا وارتفاع الحالات مرتبط بفصل الخريف
2355,كيف نعتنى بمرضى الزهايمر وسط جائحة فيروس كورونا والأغذية الصحية المناسبة؟
2356,فايزر قد تحصل على موافقة الولايات المتحدة على لقاح فيروس كورونا تليها جونسون
2357,بدء شحن عقار كورونافير لعلاج فيروس كورونا إلى المدن الروسية الكبرى
2358,"5 عادات خاطئة تجنبها ""لو بتعمل دايت"" للحصول على نتائج أفضل"
2359,س و ج.. كل ما تريد معرفته عن أسباب هشاشة العظام وطرق الوقاية
2360,آلاف المرضى لا يعرفون أنهم مصابون بالسكر من النوع الثانى فى بريطانيا
2361,اعرفها وابعد عنها.. أكلات ومشروبات كترها غلط على معدتك
2362,
2363,تعرف على طرق العلاج بالروائح واستخدامات زيت اللافندر لصحة الجسم
2364,اعراض خمول الغدة الدرقية عديدة منها الاكتئاب والإمساك
2365,فوائد البندق على صحتك وبشرتك عديدة أهمها حماية القلب
2366,الموز والصبار هيساعدوك فى السيطرة على السكري بطرق طبيعية.. اعرف ازاى
2367,التهاب المفاصل الروماتويدي يزيد خطر الإصابة بالسكرى بنسبة 23٪
2368,استشارى مناعة يكشف أهمية نبات الشيح فى تقوية الجهاز المناعى
2369,دواء التهاب المفاصل قد يقلل من الحاجة إلى أجهزة التنفس لمرضى COVID-19
2370,كيف أثرت جائحة كورونا على الصحة العقلية للبشر؟
2371,الاستجابات المناعية غير الفعالة مسئولة عن معدلات وفيات COVID-19 لدى كبار السن
2372,تعدد العلاقات الجنسية وراء انتشار سرطان عنق الرحم.. حلقة جديدة من وليد كلينك
2373,تجربة تثبت أن كورونا أكثر الفيروسات مرونة ويتحمل الحرارة فى الاختبارات
2374,اكتشاف نوع نادر من فصيلة الدم يساعد فى الوقاية من الملاريا
2375,اطمن على نفسك.. ما هو تحليل الأجسام المضادة لمرض التيتانوس؟
2376,الصحة العالمية تؤيد اختبار الأدوية العشبية الإفريقية ضد فيروس كورونا
2377,تعرفى على أهمية الحليب المدعّم لنمو طفلك
2378,كورونا يصبح أقل فتكًا مع اكتساب الأطباء خبرة فى العلاج
2379,اليوم العالمى لـ ألزهايمر.. اعرف تأثير فيروس كورونا على المصابين بالخرف
2380,روبوتات الدم.. حقن متحركة داخل الشرايين لعلاج الأمراض
2381,بروتوكول تجارب لقاح كورونا من استرازينيكا ينص على تحقيق 50% فاعلية
2382,5 أطعمة صحية تحافظ على خلايا المخ والذاكرة وتحميك من ألزهايمر
2383,هل يزيد الإجهاد من فرص الإصابة بألزهايمر.. 6 علامات تؤكد إصابتك
2384,"إرشادات ""CDC"" الجديدة تكشف إمكانية انتشار كورونا عن طريق الهواء"
2385,طرق بسيطة يمكنك من خلالها جعل منزلك مكانًا صحيًا وخاليا من الأمراض
2386,س و ج.. ما أعراض وأسباب وعلاج التهاب الحلق؟
2387,وكالة الأدوية الأوروبية تؤيد استخدام الستيرويد لعلاج كورونا
2388,هذه التغييرات فى نمط الحياة قد تقلل من مخاطر الخرف
2389,ما هو التهاب الوريد الخثارى وأسباب الإصابة به؟
2390,التوتر والضغط عصبى يؤثران على صحة الحامل والجنين
2391,ما هى الكربوهيدرات المعقدة ولماذا يجب تناولها لفقدان الوزن؟
2392,اعراض اكتئاب بعد الولادة تؤثر على الشهية والنوم والقلق
2393,فوائد صدور الدجاج على صحتك ونشاطك
2394,"هل يمكن للأحذية أن تنقل مرض ""كوفيد 19""؟.. الصحة العالمية تجيب"
2395,5 أشياء تزيد أعراض فرط الحركة ونقص الانتباه.. منها الفوضى والأكلات السريعة
2396,هل هناك طرق طبيعية لعلاج انسداد شرايين القلب؟
2397,"هل من الممكن أن تصاب الكلاب بمرض ""التوحد""؟"
2398,فوضى باختبارات كورونا ببريطانيا بسبب اندفاع الآباء فى فحص أبنائهم
2399,الموجة الثانية لكورونا فى أوروبا لا تتسبب فى ارتفاع عدد الوفيات
2400,قصة فصل توأمتين ملتصقتين من الكبد عمرهما سنة
2401,"اطمن على نفسك.. اختبارات تكشف إصابتك بـ ""حمى كيو"""
2402,
2403,51 % من موظفى المدارس فى أمريكا معرضون لخطر متزايد للإصابة بـ Covid-19
2404,"دول أمريكا اللاتينية تعتزم المشاركة بمبادرة ""كوفاكس"" للحصول على لقاح كورونا"
2405,خبير بالأمراض المعدية يؤكد عدم وجود موجة ثانية من فيروس كورونا في روسيا
2406,بريطانيا تفرض 10 آلاف جنيه إسترلينى على حاملى فيروس كورونا الرافضين للعزل
2407,الفطريات القاتلة بالمنزل تهدد رئتيك والخبراء ينصحون بتغيير الوسائد كل 6 أشهر
2408,استئناف المرحلة الثالثة لتجارب لقاح استرازينيكا لفيروس كورونا بالهند
2409,مرضى السكرى أكثر حاجة إلى لقاح الأنفلونزا.. لهذه الأسباب
2410,س و ج.. ما أعراض الإصابة بالشريان التاجى وطرق الوقاية؟
2411,الكمامة القماش تمنع عدوى كورونا حتى عند العطس
2412,مسئول أمريكي يكشف عن 3 ممارسات يومية لتقوية جهازك المناعي ضد كورونا
2413,5 أطعمة بسيطة لعلاج مشاكل البشرة وحب الشباب.. اعرف التفاصيل
2414,ما هو الزحار الأميبى وكيف يتم تشخيصه؟
2415,7 أطعمة لتنظيف القولون أبرزها الزنجبيل وعصير الخضار والفاكهة
2416,أسباب ألم الصدر عدة وأبرزها مرض السل أو تمزق المرىء
2417,دراسة تكشف حقيقة وجود علاقة بين الاكتئاب والنظام الغذائى
2418,الخصوبة المطولة عند السيدات مش دايما صح تزيد من خطر الإصابة بالخرف
2419,دراسة تكشف تعرض مرضى السكتة الدماغية المصابين بفيروس كورونا لأعراض أكثر حدة
2420,علماء يتوصلون لعلاج جديد يحد من عواقب كورونا الخطيرة
2421,جامعة أكسفورد تؤكد براءة لقاح كورونا من التسبب فى مضاعفات لمتطوع
2422,معظم حالات عدوى كورونا تنتقل فى الهواء وعبر الرذاذ وليس من الأسطح
2423,كورونا ومضاعفاته.. دراسة تؤكد نصف المرضى يعانون من إجهاد طويل الأمد
2424,تعرف على الاختلافات بين اختبارات تشخيص الإصابة بفيروس كورونا
2425,اطمن على نفسك.. أبرز الفحوصات لتشخيص الفشل الكلوى
2426,"وكالة الأدوية الأوروبية ""EMA"" تعتمد عقار ديكساميثازون لعلاج فيروس كورونا"
2427,5 حقائق عن فيروس كورونا يجب على الطفل معرفتها قبل بداية المدرسة
2428,CDC يزيل تعليمات عدم اختبار من لا تظهر عليهم أعراض كورونا
2429,الطفح الجلدى وفقدان الشهية.. علامات تفرق بين نزلات البرد وكورونا للأطفال
2430,مودرنا تستعد لإنتاج لقاح كورونا لطرحه بالأسواق بعد التأكد من الأمان والفعالية
2431,بحث علمى يؤكد أمان استخدام الأشعة فوق البنفسجية للبشر فى قتل كورونا
2432,الاتحاد الأوروبى يدفع 384 مليون دولار لشراء لقاح كورونا لشركتى سانوفى وجلاكسو
2433,إنتاج 20 مليون جرعة من لقاح مودرنا الأمريكية لفيروس كورونا نهاية العام
2434,الصين تجرى تجارب على 11 لقاحا لفيروس كورونا 4 منها فى المراحل النهائية
2435,هل يمكن لغسل أنفك باليود أن يحميك من كورونا؟
2436,"روسيا توافق على عقار ""كورونافير"" لفيروس كورونا وطرحه للبيع الأسبوع المقبل"
2437,الأطفال الذين يتناولون الستيرويد فى خطر متزايد للإصابة بمرض السكرى
2438,س و ج.. كل ما تريد معرفته عن الرجفان الأذينى
2439,كيف يؤثر انحناء إصبع القدم فى الأحذية على العضلات؟ خبراء يوضحون
2440,الفلفل الحار يحتوى على فيتامين سى أكثر من البرتقال.. اعرف فوايده للمناعة
2441,دراجتك صحتك.. اعرف فوائد ركوب العجل على جسمك وعضلاتك
2442,
2443,تعرف على أعراض الإصابة بالوسواس القهرى وتأثير جائحة كورونا
2444,حمص شام أو على الكشرى.. فوائده عديدة على صحتك
2445,كيفية السيطرة على آلام المفاصل لو مصاب بهشاشة العظام
2446,فوائد القلقاس على صحتك ووقايتك من الامراض
2447,أول دليل على أن ضوء الأشعة فوق البنفسجية يقتل الفيروسات المسببة لـ COVID-19
2448,معدل الوفيات المنخفض بفيروس كورونا فى جنوب إفريقيا يشير إلى وجود مناعة
2449,اتباع عادات صحية للقلب يقلل من مخاطر ارتفاع ضغط الدم بعد تقدم السن
2450,مسح كل شىء للوقاية من فيروس كورونا ليس ضروريا.. اعرف السبب
2451,"دراسة تظهر ارتفاع معدل انتشار ""التعب"" بعد كورونا بغض النظر عن شدة المرض"
2452,"انفجار أجزاء من شبكية عين مراهق أمريكى.. والسبب ""لعبة ليزر"""
2453,نصائح للتعامل مع الأطفال المصابين بصدمات نفسية.. إنفوجراف
2454,فايزر الأمريكية تراهن على الفوز المبكر فى تجارب لقاحها ضد فيروس كورونا
2455,شركة BioNTech الألمانية تشترى موقعًا جديدا لتكثيف إنتاج لقاح كورونا
2456,أطمن على نفسك..ما هى فحوصات عملية الليزك
2457,الوقاية من COVID-19 قد تخفض معدلات إصابات الأنفلونزا
2458,سيلان الأنف ليس من أعراض من Covid-19.. خبراء يوضحون
2459,موديرنا الأمريكية تسعى لاستخدام محدود فى حالات الطوارئ للقاح كورونا
2460,لقاح كورونا الثانى يضمن مناعة ضد الفيروس لمدة 6 أشهر
2461,هل يمكن أن يسبب فيروس كورونا مقاومة الأدوية؟
2462,س و ج.. ما علامات الإصابة بالالتهاب السحائي وأنواعه؟
2463,ماذا تخبر نبضات قلب المولود عن صحتهم؟
2464,الرجال فقط.. كيف تحافظ على صحتك مع كبر السن؟
2465,ماهو بروتين مصل اللبن وما دوره فى تقوية جهاز المناعة؟
2466,طرق وعلاجات منزلية للتخلص من جفاف وحكة العين.. تعرف عليها
2467,اعراض وأسباب وأنواع مرض السكر
2468,أعراض التهاب المفاصل عند الشباب والأطفال منها ارتفاع الحرارة وطفح جلدى
2469,اعراض قصور الدورة الدموية منها تنميل اليدين والقدمين
2470,لماذا تقل احتمالية انتشار الفيروس بالصالات الرياضية مقارنة بالنوادى الليلية
2471,فحص دم جديد للبحث عن حالات COVID-19 غير المكتشفة
2472,إعادة التطعيم بلقاح كورونا عدة مرات يعزز المناعة
2473,السكتة الدماغية قد تكون أول أعراض كورونا عند الشباب
2474,النظارات العادية تحميك من عدوى كورونا.. دراسة صينية تؤكد
2475,علماء يكتشفون العلاقة بين الأمراض الجسدية والإصابة بالاكتئاب
2476,الحوامل المصابات بمضاعفات شديدة لكورونا يتعرضن لخطر الولادة المبكرة
2477,منظمة الصحة: كل 7 مصابين بكورونا بينهم واحد من العاملين بالقطاع الصحى
2478,دراسة لأكسفورد تكشف العلاقة بين هرمون النمو وخطر الإصابة بسرطان الغدة الدرقية
2479,اطمن على نفسك.. لماذا يطلب الطبيب أشعة على الجمجمة؟
2480,شركة أمريكية تعلن نجاح علاجها بالأجسام المضادة فى تقليل أعراض كورونا
2481,واحد من كل 7 متطوعين فى تجارب لقاح كورونا الروسى تعرضوا لآثار جانبية
2482,
2483,اختبار مياه نهر بالهند بحثا عن تأثيرات علاجية محتملة فى مكافحة كورونا
2484,هذه الفئات يجب عليها الحصول على لقاح الإنفلونزا قبل دخول الشتاء
