id,text
1124,6 تغييرات فى جلدك تدل على إصابتك بمرض السكرى
1125,"تعرف على سر مناعة الهند ضد كورونا ""الشديدة ""رغم ارتفاع الإصابات"
1126,هل الأطفال مصدر لنقل عدوى كورونا؟ علماء الأوبئة يجيبون
1127,حالة غير عادية لمصابة بسرطان الدم ظلت معدية بفيروس كورونا لمدة 70 يوما
1128,دراسة كندية: 1 من كل 5 مرضى كورونا يظهر عليه أعراض معوية فقط
1129,العلاج بالعقاقير المخفضة للكوليسترول يقلل من وفيات كورونا بنسبة 22٪
1130,اختبار كورى جديد للكشف عن كورونا والأنفلونزا فى 3 ساعات
1131,أدوية جديدة لإنقاص الوزن وعلاج أمراض السمنة
1132,خطة الصحة البريطانية لإطلاق لقاح كورونا الشامل بحلول الكريسماس
1133,إعدام حيوان المنك بالدنمارك بعد ظهور طفرات لفيروس كورونا قد تؤثر على اللقاح
1134,4 طرق لاستعادة صحتك وعافيتك بعد التعافى من كورونا
1135,أمصال الهند: طرح لقاح أكسفورد لكورونا يناير 2021
1136,أحدث أبحاث العلماء.. قطرات السعال تتطاير لمسافة 6.6 متر لنقل كورونا
1137,آكل لحوم البشر.. مرض نادر يتسبب فى تعفن لحم وجه أيرلندية ويعرضها للتنمر
1138,فيتامين د يقلل من أعراض الأكزيما الحادة عند الأطفال
1139,الرمان مش بس فاكهة.. هيحميك من كورونا ويعالج نزلات البرد
1140,كيف تقلل فرص المعاناة من آلام ظهرك مع تقدمك فى العمر؟
1141,متتخضش.. ورم الدماغ لا يعنى دائماً أنك مصاب بالسرطان
1142,كل ما تريد معرفته عن أنواع وأسباب شامات الجلد
1143,6 عادات صحية بسيطة ادمجها فى يومك لصحة أفضل
1144,سر الخلايا البائية للمتعافين من كورونا
1145,هل يساعدك مكمل الميلاتونين على النوم بشكل أفضل؟
1146,الكمامة و القناع سلاح الدول للسيطرة على موسم كورونا
1147,6 آثار جانبية للإفراط في استهلاك الكربوهيدرات
1148,س و ج.. كل ما تريد معرفته عن التهابات المسالك البولية وأعراضها
1149,3 لقاحات تنتجها الهند قد تجعلها فى المركز الثانى لإنتاج تطعيمات كورونا
1150,التحدث لمدة 30 دقيقة مع مريض كورونا قد تنشر العدوى.. اعرف التفاصيل
1151,أدوية هشاشة العظام يمكن أن تقلل الإصابات بكورونا
1152,تلف أعصاب الأحبال الصوتية يسبب ظهور أعراض كورونا طويلة المدى
1153,أطفال كورونا عرضة للإعاقات الجسدية والبصرية والشلل الدماغى
1154,آباء أطفال المدارس أقل عرضة لمضاعفات كورونا .. دراسة تؤكد
1155,علاج هرمونى يساعد فى تعافى مرضى المتلازمة التنفسية الحادة
1156,الصحة العالمية تحذر من تفشى الأنفلونزا بين الأطفال والحوامل خلال جائحة كورونا
1157,20 ٪ من مرضى كورونا ظهرت عليهم أعراض الجهاز الهضمى فقط
1158,مجلة أمريكية: تطعيم الأنفلونزا له تأثير وقائى من كورونا
1159,قرنية العين يمكن أن تقاوم العدوى بفيروس كورونا المستجد
1160,خطة بهارات بيوتك لإنتاج 500 مليون جرعة من لقاح كوفاكسين الهندى
1161,الصحة العالمية توافق على لقاح جديد لشلل الأطفال لإعطائه بالحقن بدلا من الفم
1162,
1163,16 سلالة جديدة من فيروس كورونا بجنوب إفريقيا على الرغم من الإغلاق
1164,درجة الحرارة والرطوبة لا تلعبان دورا مهما فى انتشار كورونا.. دراسة توضح
1165,"احتياطات ضرورية لـ""الحامل"" قبل الولادة فى زمن كورونا والفيتامينات مهمة"
1166,تعرف على أسباب الإصابة بالإكزيما حول العين وأعراضها المختلفة
1167,نصائح لجميع الفئات العمرية للحفاظ على قلب صحى وسليم
1168,هتتمرن فى الشغل..7 تمارين سريعة للوقاية من آلام الرقبة والظهر أثناء العمل
1169,6 طرق تزيد مستويات فيتامين د فى الجسم.. منها المأكولات البحرية
1170,النظام الغذائى منخفض الكربوهيدرات يساعد فى علاج مرضى السكرى لكبار السن
1171,دراسة تكشف مؤشرات تفيد بإمكانية تراجع حدة كورونا بنسبة 80%
1172,تعرف على الأسباب الخفية لتقلصات المعدة عند الرجال
1173,تعرف على علامات الخلل الهرمونى عند النساء والرجال
1174,مرضى كورونا لديهم مناعة ضد الفيروس لمدة 6 أشهر من الإصابة
1175,العلماء يحددون 7 أعراض لفيروس كورونا فى الحالات المعتدلة
1176,دراسة تحدد سببًا جديدًا لجلطات الدم لمرضى كورونا
1177,دراسة صينية تظهر كيف يمنع عقار ريمديسيفير تكرار الإصابة بكورونا
1178,اكتشاف مادة طبيعية جديدة تساعد فى علاج مرض الزهايمر
1179,ارتفاع ضغط الدم أثناء النوم يزيد خطر الإصابة بأمراض القلب والسكتة الدماغية
1180,أستاذ طب نفسى: شائعات وسائل التواصل الاجتماعى تسبب التوتر والاكتئاب
1181,فيتامين د أثناء الحمل يزيد معدل الذكاء عند الأطفال
1182,"إصابة لاعب كرة القدم ""تشارلتون"" بالزهايمر.. هل ضرب الكرة بالرأس السبب؟"
1183,تعرف على خطة التطعيم الجماعى للقاح كورونا الروسى
1184,تقرير أمريكى: النساء الحوامل أكثر عرضة لمضاعفات كورونا
1185,نموذج جديد لقياس معدلات تنفس الأشخاص لتتبع القطرات الحاملة للفيروسات
1186,كيف تحميك تدابير الوقاية من كورونا من عدوى البرد والأنفلونزا أيضاً؟
1187,س وج .. ما هو مرض الخوف من الأماكن المغلقة وعلاجه؟
1188,"التوصل لبخاخ للأنف لعلاج طنين الأذن من ""هرمون الحب"""
1189,الأرجنتين تعتزم شراء 15 مليون جرعة من لقاح كورونا الروسى سبوتنيك
1190,الرخاوي: التعرف على شخصية المريض أهم خطوة لتشخيص مرضه النفسي
1191,لقاح جديد لفيروس كورونا من الجسيمات النانونية يؤدى لاستجابة مناعية أقوى
1192,"الرخاوي لـ""اليوم السابع"": كورونا زاد من حدة الأمراض النفسية.. أبرزها الخوف"
1193,كيورفاك الألمانية تخطط لإطلاق المرحلة النهائية من تجارب لقاح كورونا
1194,أسباب تؤدى لظهور خراج الأسنان وعلامات الإصابة
1195,عشان تعزز مناعتك فى فصل الشتاء..7 فواكه مهمة لصحتك
1196,أعراض الإصابة بجرثومة المعدة وطرق الوقاية منها
1197,جوارب طبية لعلاج رائحة القدم الكريهة
1198,"""شرى البرد"" أخطر أمراض الشتاء والسبب المياه الساخنة"
1199,احذر.. حبس أنفاسك أثناء التمارين يعرضك لارتفاع ضغط الدم ومشاكل صحية
1200,كحولك فى إيدك.. 3 أشياء نظفها يومياً للوقاية من الأمراض وكورونا
1201,اعرفى السبب.. ليه طفلك بيعانى من السعال المستمر
1202,
1203,ما العوامل التى قد تؤدى إلى إنجاب أطفال مصابين بمتلازمة داون؟
1204,اختلافات واضحة بين فيروس كورونا وأنفلونزا الخنازير .. الأخيرة لها لقاح
1205,علامات تحذرك من الإصابة بالخرف .. تعرف عليها وطرق الوقاية
1206,الفرق بين كسور العظام وتمزق الأربطة .. اعرف أسباب الكسر والعلاج
1207,فوائد السمك لصحة الجسم .. تعرف على أفضل أنواعه لوضعها ضمن نظامك الغذائى
1208,لمواجهه تقلبات الطقس ..5 أطعمه لتقوية جهازك المناعى ومقاومة العدوى
1209,اختبار كورونا السلبى لا يعني أنك اكتسبت المناعة.. تعرف على الأسباب
1210,نشط التركيز والذاكرة عند طفلك بحيل بسيطة.. منهم التصور والذاكرة البصرية
1211,التوابل تقلل الالتهاب وتمنع مخاطر الوجبات الغنية بالدهون
1212,س وج.. كل ما تريد معرفته عن اضطراب التوحد
1213,فوائد تناول الباذنجان على صحتك.. يحافظ على سلامة قلبك
1214,لماذا يجب تفادى الإصابة بكورونا حتى إذا كنت تعافيت من الفيروس.. إنفوجراف يجيب
1215,وكيل حميات العباسية: التقلبات الجوية تؤدى للخلط بين كورونا والأنفلونزا الموسمية
1216,الصحة البريطانية تراجع بيانات لقاح استرازينيكا لفيروس كورونا لتسريع الموافقة
1217,روسيا تطلب الحصول على ترخيص لإنتاج عقار ريميديسيفير الأمريكى لعلاج كورونا
1218,انطلاق التجارب النهائية للقاح كوفاكسين الهندى 14 نوفمبر الجارى
1219,التمارين الرياضية تحميك من الإصابة بعدوى كورونا وتزيد فعالية اللقاح
1220,إطلاق لقاح كوفاكسين الهندى لفيروس كورونا منتصف 2021
1221,6 حقائق عن مرض السكر وعلاقته بسرطان البنكرياس
1222,نصائح لتغذية طفلك في مرحلة ما قبل المدرسة.. أبرزها اهتمى بالأكل الصحي
1223,"أستاذة أورام: اكتشاف السرطان فى المرحلة ""صفر"" معناه الشفاء التام"
1224,ما هى عملية زرع نخاع العظم
1225,العيش قرب المساحات الخضراء يجعلك أقل عرضة للتدخين ويعزز إقلاعك عن العادة السيئة
1226,فوائد الجمبرى على صحة الجسم.. مضاد للأكسدة ويمنحك الفيتامينات والزنك
1227,لو سنة أولى أمومة فى فصل الشتاء.. اعرفى ازاى تتعاملى مع طفلك
1228,عشان شعرك يفضل صحى..5 فيتامينات لنمو أفضل للبصيلات
1229,5 زيوت طبيعية هتساعدك في علاج قرح البرد..تعرف عليها
1230,س وج.. كل ما تريد معرفته عن الإغماء المتكرر وكيف تمنع هذه الحالة الخطيرة
1231,ماذا يعنى انخفاض نسبة السكر فى الدم وما أبرز علامات الإصابة؟
1232,إرشادات جديدة لمرضى السكر من النوع الأول لممارسة الرياضة بأمان.. تعرف عليها
1233,ما هى أنواع وأسباب التهاب الأذن الوسطى؟
1234,أشهر أمراض تنتقل عن طريق الاتصال الجنسى.. الكلاميديا الأبرز
1235,أعراض الاكتئاب تزيد خطر إصابتك بالسكتة الدماغية.. دراسة تؤكد
1236,لماذا يصاب الأطفال بأعراض كورونا طويلة الأمد؟
1237,عميد معهد السكر: 9 إلى 15 مليون مصاب بالسكر فى مصر والمرض يسبب مضاعفات خطيرة
1238,دراسة تؤكد تلوث أرضيات غرف المستشفيات بالبكتيريا المقاومة للمضادات الحيوية
1239,علامات تنذرك بالتهاب المفاصل الروماتويدي الشديد
1240,خبراء يتوقعون زيادة قتلى كورونا بأمريكا 3 أضعاف منتصف يناير 2021
1241,8 نصائح مهمة تساعد على علاج التهاب القولون
1242,
1243,احذر الجرعة الفيروسية تصنع السم وتحدد مدى إصابتك بكورونا من عدمه
1244,ما أعراض البهاق؟.. الفقدان الرقعى للون الجلد أبرز علامات الإصابة بالمرض
1245,دراسة تكشف قدرة بكتيريا الأمعاء على حماية الجسم من جرعات الإشعاع
1246,جمعية إيطالية تحذر من مخاوف من ارتفاع وفيات مرضى القلب بسبب كورونا
1247,لماذا يعتبر سرطان الرئة أكثر شيوعا؟ تعرف على أهم 6 نصائح للوقاية من الإصابة
1248,كيف تستعد لاستقبال فصل الشتاء مع كورونا؟
1249,"علماء يطالبون بإضافة ""فيتامين د"" إلى الخبز والحليب للمساعدة بـ""محاربة كورونا"""
1250,تقنية جديدة تُظهر كيف يقوم فيروس كورونا بإخفاء نفسه داخل جسم الإنسان
1251,شركة أمريكية تخطط لاختبار لقاح كورونا على الأطفال من 12 إلى 18 عاما
1252,معركة فى البرزايل حول لقاح سينوفاك الصينى لمواجهة فيروس كورونا
1253,قبل الحصول على لقاح الانفلونزا .. أعراض جانبية بسيطة وتنتهى خلال ساعات
1254,س و ج.. هل حصولك على الأجسام المضادة يعنى أنك آمن ضد كورونا؟
1255,أمل جديد فى علاج السرطان .. تدريب جهاز المناعة على قتل الأورام
1256,التوتر يزيد فرص الإصابه بالسكتة الدماغية..اعرف إزاى تتغلب على مرض يهدد الحياة
1257,مشاكل صحية يمكن أن تشير إليها أظافرك من البقع البيضاء إلى النتوءات
1258,فوائد البرتقال على صحة الجسم .. يقى من الفيروسات والجراثيم
1259,نصائح لتعزيز مناعة كبار السن وتقوية نظام الدفاع فى الجسم
1260,ما هو اضطراب الجلد الأزرق وأبرز أسبابه
1261,عشان ابتسامتك تفضل صحية .. اعرف التقويم المناسب ليك
1262,"الإفراط في تناول فيتامين""د"" ضار بصحتك .. تعرف على سُمية الكمية الزائدة"
1263,تناول المكملات الغذائية أثناء علاج سرطان الثدى تسبب مخاطر كبيرة
1264,فحوصات الرئة لمرضى السكتة الدماغية يمكن أن توفر اكتشافًا مبكرًا لـ COVID-19
1265,دراسة تزعم أن إحدى طفرات كورونا المستجد جعلته أكثر الفيروسات نقلا للعدوى
1266,الأسبرين قد يقلل من مخاطر الوفاة لدى مرضى COVID-19 الحاد بنسبة 47%
1267,قياس الحمل الفيروسى لدى مرضى كورونا قد يساعد فى التنبؤ بالحالات الخطيرة
1268,فيروس كورونا قد يستهدف النخاع ويمنع تكوين كريات الدم الحمراء الجديدة
1269,اليابان تطور اختبار أجسام مضادة لفيروس كورونا باستخدام ديدان القز
1270,استرالية شفيت من كورونا أواخر مارس ومازالت تعانى آثار جانبية.. اعرف حكايتها
1271,مجلة أمريكية.. بعض المتعافين من كورونا يحملون الفيروس والحذر واجب
1272,مرشح دوائي جديد لعلاج COVID-19 يستخدم فى روسيا لعلاج الإنفلونزا
1273,"7 نصائح تساعد على تقليل مخاطر الإصابة بأمراض القلب.. اعرف إيه هى ""انفوجراف"""
1274,حقن الكمامة بمواد مضادة للفيروسات يوقف انتشار كورونا .. اعرف السبب
1275,مرضى كورونا الذين يعانون من أعراض طويلة قد يعانون أيضا من مشاكل جلدية
1276,مرضى كورونا ينشرون العدوى فى المنزل بنسبة 53 %والحل الوقاية والتباعد للأصحاء
1277,انطلاق تجارب لقاح أكسفورد لفيروس كورونا فى كينيا
1278,أجهزة مراقبة اللياقة البدنية القابلة للإرتداء يمكنها التنبؤ بعدوى كورونا
1279,تقرير يكشف .. 20 ٪ من عمال البقالة بأمريكا مصابون بـ Covid-19 بدون أعراض
1280,هل ينتشر كورونا بسهولة أكبر فى درجات الحرارة الباردة؟
1281,تقنية جديدة للكشف عن حالات عدوى كورونا بدون أعراض من خلال السعال المسجل على المحمول
1282,
1283,دواء السكر من النوع 2 يساعد فى منع الإصابة بمرض باركنسون.. دراسة توضح
1284,تسمم غذائى ولا أنفلونزا المعدة.. علامات وأعراض هتقولك الفرق
1285,نصائح صحية لزيادة معدل التمثيل الغذائى وحرق دهون البطن
1286,هل يساعد خل التفاح فى علاج الصدفية؟
1287,5 أطعمة تحميك من مشاكل جفاف الجلد فى الشتاء.. تعرف عليها
1288,اسباب انخفاض عدد الصفائح الدموية عديدة منها الأدوية
1289,فوائد تناول السمك البورى على صحة الجسم
1290,مادة من أسماك القرش تستخدم فى لقاحات كورونا.. وقلق بين علماء البيئة
1291,دراسة سويسرية: أخذ جرعات عالية من مسكنات الألم قد يصيبك بالتسمم
1292,سنغافورة تطور اختباراً لتحليل التنفس لاكتشاف مصابى كورونا فى دقيقة واحدة
1293,لو وزنك زاد بعد حلاوة المولد.. نصائح سريعة للتخسيس
1294,تعرف على حقيقة وقف تجارب لقاح كورونا الروسى
1295,جامعة أكسفورد تطور اختبارا جديدا لكورونا للكشف عن المصابين بدون أعراض
1296,دراسة هندية تؤكد نجاح لقاح السل فى مساعدة كبار السن لمحاربة كورونا
1297,90% من متعافى كورونا لديهم أجسام مضادة لمدة 5 أشهر تقتل الفيروس
1298,معهد أمصال الهند: لقاح أكسفورد لكورونا سيكون جاهزا فى ديسمبر المقبل
1299,علماء يحذرون من 850 ألف فيروس غير مكتشف فى الحيوانات قد تصيب البشر
1300,سلالة متحولة من كورونا نشأت بإسبانيا قد تكون سبب الموجة الثانية فى أوروبا
1301,مودرنا الأمريكية تعلن استعدادها لإطلاق لقاحها التجريبى لكورونا
1302,نجاح عملية فصل توأم ملتصق من الرأس بكاليفورنيا بعد جراحة 24 ساعة.. فيديو وصور
1303,العزلة الاجتماعية تجعل النساء أكثر عرضة للإصابة بارتفاع ضغط الدم
1304,مضادات الصرع أثناء الحمل تضاعف خطر إنجاب أطفال مصابين بالتوحد
1305,كثرة السكريات فى نظامك الغذائى تزيد خطر إصابتك بالتهاب القولون
1306,علماء يطورون رقعة قلبية تحتوى على أوعية دموية لعلاج متلازمة القلب المكسور
1307,لماذا يفقد مريض كوورنا حاسة الشم قبل الإصابة بالحمى؟
1308,دراسة أمريكية: المتعافون من كورونا لديهم أجسام مضادة بنسبة 11.5 ٪
1309,أبحاث تكشف سبب عدم ظهور أعراض على بعض الأشخاص المصابين بكورونا
1310,تعرف على فوائد الحمص الصحية.. السيطرة على السكر وتحسين الهضم
1311,دراسة تكشف فشل التطعيمات الجماعية في المناعة ضد كورونا
1312,كبسولة عشبية تظهر فعاليتها فى علاج الالتهاب الرئوى لدى مرضى كورونا
1313,دراسة أمريكية تكشف عن جسم مضاد قوى يحارب فيروس كورونا
1314,17 % من المتعافين من كوورنا لا يزالون يعانون أعراض تنفسية
1315,متعافيات من كورونا يؤكدن استمرار الأعراض لوقت طويل
1316,3 أشياء تزيد خطر إصابتك بفيروس كورونا مرة أخرى
1317,اعراض غيبوبة السكر عديدة منها الصداع والدوخة
1318,مشروبات صديقة لمرضى السكر تساعد فى التحلية بدون مضاعفات
1319,رئيس قسم الأعصاب بطب عين شمس: السكتة الدماغية تصيب 250 ألف مصرى سنويا
1320,احذر.. العمل البدنى الشاق يزيد خطر الإصابة بالخرف بنسبة 55%
1321,تجربة عقارين مضادين للفيروسات لعلاج الأنفلونزا والإيدز على مرضى كورونا
1322,
1323,لقاح الأنفلونزا قد يقلل خطر الإصابة بكورونا.. دراسة تؤكد
1324,كبار السن أكثر عرضة للإصابة بالسكتة الدماغية بين مرضى كورونا
1325,تعرف على الأعرض السبعة للسكتة الدماغية .. إنفوجراف
1326,استمرار تجارب لقاح سبوتنيك الروسى لكورونا فى الهند حتى مارس المقبل
1327,تاكيدا اليابانية تستورد 50 مليون جرعة من لقاح كورونا الأمريكى
1328,منظمة الصحة العالمية تحذر: التبغ يقتل أكثر من 8 ملايين شخص كل عام
1329,احذر الإكثار منها.. حلوى المولد علاج للاكتئاب لاحتوائها الزنك والماغنسيوم
1330,عالم روسى يصيب نفسه بعدوى كورونا مرتين ليكتشف اختفاء الأجسام المضادة سريعا
1331,"اكتشاف متلازمة ""فيكساس"" تصيب الرجال فقط بمشاكل صحية خطيرة"
1332,الصحة العالمية: لا يوجد علاج لكورونا حتى الآن والإصابات تنذر بالخطر
1333,علماء أمريكان يتوصلون لطريقة جديدة لعلاج أمراض شبكية العين
1334,فايزر تكشف عن خطتها لتسليم 40 مليون جرعة للقاح كورونا للولايات المتحدة
1335,اكتشاف حالات عدوى بفيروس كورونا بين المتطوعين فى تجارب اللقاح الروسى
1336,كيف تضيف المزيد من الحديد إلى نظامك الغذائى؟
1337,"نصائح للعناية ببشرة الطفل ""الجديد"" فى الشتاء"
1338,دراسة كندية: الأسر الكبيرة قد تتعرض لانتشار كورونا بشكل أسرع
1339,نظام تطهير جديد يمكنه القضاء على كورونا فى بضع دقائق
1340,طقطقة الكتف أو الفك وصفير الأنف وطنين الأذن.. ماذا تعنى أصوات جسمك؟
1341,مراقبة مياه الصرف الصحى.. كيف يتتبع العلماء كورونا قبل انتشارها؟
1342,تعرف على فوائد البطاطس للصحة دعم القلب ومنع هشاشه العظام
1343,الخلايا التائية طريقة فعالة لحماية الأشخاص المعرضين للخطر من كورونا
1344,المصابون بكورونا بدون أعراض يفقدون الأجسام المضادة.. دراسة توضح
1345,تناول فيتامين A و E و D يمنع أمراض الجهاز التنفسى
1346,دراسة تكشف: مرضى كورونا يعانون من أعراض معدية معوية لاحقا
1347,اطمن على نفسك.. هل توجد تحاليل لتشخيص جدرى الماء؟
1348,4 طرق طبيعية لمحاربة الصداع النصفى.. انتبه للمحفزات
1349,النساء قادرات على قهر عدوى الملاريا أسرع من الرجال .. دراسة تكشف
1350,تناول الأوميجا 3 يحمى مرضى القلب من مضاعفات ما بعد الأزمة
1351,امبريال كوليدج: مصابو كورونا بدون أعراض يفقدون الأجسام المضادة بسرعة
